{
  "$schema": "https://json-schema.org/draft/2020-12/schema",
  "$id": "https://smerc.example/schemas/smerc-access-token-v1.schema.json",
  "title": "SMERC Short-Lived Access Token v1 Claims",
  "type": "object",
  "additionalProperties": false,
  "required": [
    "version", "session_id", "issuer", "audience", "tenant_id",
    "principal_id", "scopes", "source_legacy", "issued_at",
    "not_before", "expires_at"
  ],
  "properties": {
    "version": {"const": "smerc.access-token.v1"},
    "session_id": {"type": "string", "pattern": "^session_[0-9a-f]{32}$"},
    "issuer": {"const": "smerc-pilot-api"},
    "audience": {"const": "smerc-runtime-api"},
    "tenant_id": {"type": "string", "pattern": "^[A-Za-z0-9][A-Za-z0-9._-]{0,63}$"},
    "principal_id": {"type": "string", "pattern": "^[A-Za-z0-9][A-Za-z0-9._-]{0,63}$"},
    "scopes": {
      "type": "array",
      "minItems": 1,
      "maxItems": 8,
      "uniqueItems": true,
      "items": {
        "enum": [
          "actions.evaluate", "decisions.read", "permits.issue", "permits.consume",
          "reviews.read", "reviews.write", "metrics.read", "audit.read"
        ]
      }
    },
    "source_legacy": {"type": "boolean"},
    "issued_at": {"type": "integer", "minimum": 0},
    "not_before": {"type": "integer", "minimum": 0},
    "expires_at": {"type": "integer", "minimum": 1}
  }
}
