{
  "version": "smerc.access-token.v1",
  "session_id": "session_0123456789abcdef0123456789abcdef",
  "issuer": "smerc-pilot-api",
  "audience": "smerc-runtime-api",
  "tenant_id": "platform-team",
  "principal_id": "github-proposer",
  "scopes": ["actions.evaluate"],
  "source_legacy": false,
  "issued_at": 1783141200,
  "not_before": 1783141200,
  "expires_at": 1783141500
}
